{
  "id": "eval_scope_boundary",
  "name": "Scope Boundary",
  "status": "draft",
  "appliesTo": [
    "all-agents"
  ],
  "criteria": [
    "Agent stays inside active release scope.",
    "Agent does not introduce implementation details before the relevant release.",
    "Agent proposes decision records for scope changes."
  ],
  "failureMode": "Agent silently expands scope beyond repository-approved boundaries."
}
